{"$schema":"https://json-schema.org/draft/2020-12/schema","title":"Continuity Works Facility Reference","type":"object","required":["reference_id","version","archetype_id","corporate_language_id","description","size","module_composition","present_signatures","blueprint","materialization"],"properties":{"reference_id":{"type":"string","pattern":"^[a-z0-9_.-]+:reference/[A-Za-z0-9_./-]+$"},"version":{"type":"integer","minimum":1},"archetype_id":{"type":"string"},"corporate_language_id":{"type":"string"},"description":{"type":"string"},"size":{"type":"array","prefixItems":[{"type":"integer","minimum":1},{"type":"integer","minimum":1},{"type":"integer","minimum":1}],"minItems":3,"maxItems":3},"module_composition":{"type":"array","items":{"type":"object","required":["module_id","origin"],"properties":{"module_id":{"type":"string"},"origin":{"type":"array","prefixItems":[{"type":"integer"},{"type":"integer"},{"type":"integer"}],"minItems":3,"maxItems":3}}}},"present_signatures":{"type":"array","items":{"type":"string"},"uniqueItems":true},"blueprint":{"type":"array","items":{"type":"object","required":["op"],"properties":{"op":{"enum":["block","fill_box","hollow_box","line","cylinder"]},"role":{"type":"string"},"block":{"type":"string","pattern":"^minecraft:[a-z0-9_./-]+$"}},"additionalProperties":true}},"materialization":{"type":"object","required":["format","block_policy","purpose"]}}}
