{"reference_id":"continuityworks:reference/atlas_basin_bulk_tank_farm","version":1,"archetype_id":"continuityworks:archetype/bulk_tank_farm","corporate_language_id":"continuityworks:corporate/atlas_basin_refining","description":"Orderly bulk fuel tank farm reference with four repeated vessels, containment boundary, visible pipe header, operations building, and loading gantry.","size":[37,10,31],"module_composition":[{"module_id":"continuityworks:module/storage_tank_9x7x9","origin":[4,1,4]},{"module_id":"continuityworks:module/storage_tank_9x7x9","origin":[16,1,4]},{"module_id":"continuityworks:module/storage_tank_9x7x9","origin":[4,1,16]},{"module_id":"continuityworks:module/storage_tank_9x7x9","origin":[16,1,16]},{"module_id":"continuityworks:module/pipe_rack_5x5x13","origin":[27,1,14]},{"module_id":"continuityworks:module/loading_gantry_9x6x7","origin":[27,1,22]},{"module_id":"continuityworks:module/utility_service_9x5x9","origin":[26,1,2]}],"present_signatures":["repeated_storage_tanks","containment_perimeter","pipe_header","loading_point","control_building","security_fence","service_lanes"],"blueprint":[{"op":"fill_box","min":[0,0,0],"max":[36,0,30],"role":"ground"},{"op":"hollow_box","min":[1,1,1],"max":[35,3,29],"role":"fence"},{"op":"hollow_box","min":[3,1,3],"max":[25,2,25],"role":"secondary_wall"},{"op":"cylinder","center":[8,8],"radius":4,"y_min":1,"y_max":7,"mode":"shell","caps":true,"role":"tank"},{"op":"cylinder","center":[20,8],"radius":4,"y_min":1,"y_max":7,"mode":"shell","caps":true,"role":"tank"},{"op":"cylinder","center":[8,20],"radius":4,"y_min":1,"y_max":7,"mode":"shell","caps":true,"role":"tank"},{"op":"cylinder","center":[20,20],"radius":4,"y_min":1,"y_max":7,"mode":"shell","caps":true,"role":"tank"},{"op":"line","start":[8,2,13],"end":[8,2,26],"role":"pipe"},{"op":"line","start":[20,2,13],"end":[20,2,26],"role":"pipe"},{"op":"line","start":[8,2,26],"end":[30,2,26],"role":"pipe"},{"op":"line","start":[20,2,26],"end":[30,2,26],"role":"pipe"},{"op":"hollow_box","min":[27,1,3],"max":[33,4,8],"role":"primary_wall"},{"op":"fill_box","min":[27,5,3],"max":[33,5,8],"role":"roof"},{"op":"fill_box","min":[27,1,22],"max":[35,1,28],"role":"hazard"},{"op":"line","start":[28,1,23],"end":[28,5,23],"role":"metal"},{"op":"line","start":[34,1,23],"end":[34,5,23],"role":"metal"},{"op":"line","start":[28,5,23],"end":[34,5,23],"role":"metal"},{"op":"line","start":[31,5,23],"end":[31,5,28],"role":"pipe"}],"materialization":{"format":"vanilla_blueprint_primitives/v1","block_policy":"minecraft_namespace_only","purpose":"architectural_reference_not_engineering_specification"}}
