{"reference_id":"continuityworks:reference/atlas_basin_compact_diesel_refinery","version":1,"archetype_id":"continuityworks:archetype/compact_diesel_refinery","corporate_language_id":"continuityworks:corporate/atlas_basin_refining","description":"Compact diesel-refinery architectural reference with two tall process columns, dense pipe rack, product tanks, isolated flare, loading gantry, and separated control building.","size":[45,20,37],"module_composition":[{"module_id":"continuityworks:module/process_column_5x16x5","origin":[12,1,11]},{"module_id":"continuityworks:module/process_column_5x16x5","origin":[20,1,13]},{"module_id":"continuityworks:module/pipe_rack_5x5x13","origin":[12,1,12]},{"module_id":"continuityworks:module/storage_tank_9x7x9","origin":[3,1,24]},{"module_id":"continuityworks:module/storage_tank_9x7x9","origin":[14,1,25]},{"module_id":"continuityworks:module/loading_gantry_9x6x7","origin":[27,1,27]},{"module_id":"continuityworks:module/flare_stack_3x20x3","origin":[40,0,4]},{"module_id":"continuityworks:module/utility_service_9x5x9","origin":[2,1,2]}],"present_signatures":["process_columns","dense_pipe_network","product_tanks","flare_stack","loading_gantry","control_building","utility_yard","perimeter_security"],"blueprint":[{"op":"fill_box","min":[0,0,0],"max":[44,0,36],"role":"ground"},{"op":"hollow_box","min":[1,1,1],"max":[43,3,35],"role":"fence"},{"op":"hollow_box","min":[3,1,3],"max":[10,5,9],"role":"primary_wall"},{"op":"fill_box","min":[3,6,3],"max":[10,6,9],"role":"roof"},{"op":"cylinder","center":[14,13],"radius":2,"y_min":1,"y_max":15,"mode":"shell","caps":true,"role":"tank"},{"op":"cylinder","center":[22,15],"radius":2,"y_min":1,"y_max":17,"mode":"shell","caps":true,"role":"tank"},{"op":"line","start":[14,5,13],"end":[22,5,13],"role":"pipe"},{"op":"line","start":[22,5,13],"end":[22,5,25],"role":"pipe"},{"op":"line","start":[10,4,16],"end":[30,4,16],"role":"pipe"},{"op":"line","start":[10,5,17],"end":[30,5,17],"role":"pipe"},{"op":"line","start":[12,1,16],"end":[12,6,16],"role":"metal"},{"op":"line","start":[18,1,16],"end":[18,6,16],"role":"metal"},{"op":"line","start":[24,1,16],"end":[24,6,16],"role":"metal"},{"op":"line","start":[30,1,16],"end":[30,6,16],"role":"metal"},{"op":"cylinder","center":[7,28],"radius":4,"y_min":1,"y_max":7,"mode":"shell","caps":true,"role":"tank"},{"op":"cylinder","center":[18,29],"radius":4,"y_min":1,"y_max":7,"mode":"shell","caps":true,"role":"tank"},{"op":"fill_box","min":[27,1,27],"max":[35,1,33],"role":"hazard"},{"op":"line","start":[28,1,28],"end":[28,6,28],"role":"metal"},{"op":"line","start":[34,1,28],"end":[34,6,28],"role":"metal"},{"op":"line","start":[28,6,28],"end":[34,6,28],"role":"metal"},{"op":"line","start":[31,6,28],"end":[31,6,33],"role":"pipe"},{"op":"line","start":[41,1,5],"end":[41,18,5],"role":"dark_metal"},{"op":"line","start":[39,1,5],"end":[41,2,5],"role":"pipe"},{"op":"block","pos":[41,19,5],"role":"flare"},{"op":"fill_box","min":[37,0,1],"max":[44,0,9],"role":"gravel"}],"materialization":{"format":"vanilla_blueprint_primitives/v1","block_policy":"minecraft_namespace_only","purpose":"architectural_reference_not_engineering_specification"}}
