{"reference_id":"continuityworks:reference/frontier_rural_gas_station","version":1,"archetype_id":"continuityworks:archetype/rural_gas_station","corporate_language_id":"continuityworks:corporate/frontier_cooperative","description":"Rural cooperative gas station reference: heavier simple canopy, gabled store, gravel service yard, green/yellow identity, and short sign.","size":[29,9,25],"module_composition":[{"module_id":"continuityworks:module/standard_room_9x5x9","origin":[2,1,2]},{"module_id":"continuityworks:module/fuel_canopy_13x5x9","origin":[14,1,10]},{"module_id":"continuityworks:module/pump_island_3x3x5","origin":[17,1,12]},{"module_id":"continuityworks:module/pump_island_3x3x5","origin":[22,1,12]},{"module_id":"continuityworks:module/roadside_pylon_3x9x3","origin":[2,0,19]}],"present_signatures":["fuel_canopy","pump_islands","storefront","roadside_pylon","brand_band","parking","rear_service"],"blueprint":[{"op":"fill_box","min":[0,0,0],"max":[28,0,24],"role":"gravel"},{"op":"fill_box","min":[0,0,10],"max":[28,0,24],"role":"ground"},{"op":"hollow_box","min":[2,1,2],"max":[12,5,8],"role":"primary_wall"},{"op":"fill_box","min":[4,1,8],"max":[10,3,8],"role":"glass"},{"op":"fill_box","min":[1,6,2],"max":[13,6,8],"role":"roof"},{"op":"line","start":[1,6,2],"end":[7,8,5],"role":"roof"},{"op":"line","start":[13,6,2],"end":[7,8,5],"role":"roof"},{"op":"fill_box","min":[2,5,8],"max":[12,5,8],"role":"accent_primary"},{"op":"fill_box","min":[14,5,10],"max":[26,5,18],"role":"roof"},{"op":"fill_box","min":[14,5,10],"max":[26,5,10],"role":"accent_primary"},{"op":"line","start":[15,1,11],"end":[15,4,11],"role":"secondary_wall"},{"op":"line","start":[25,1,11],"end":[25,4,11],"role":"secondary_wall"},{"op":"line","start":[15,1,17],"end":[15,4,17],"role":"secondary_wall"},{"op":"line","start":[25,1,17],"end":[25,4,17],"role":"secondary_wall"},{"op":"fill_box","min":[17,1,12],"max":[18,2,15],"role":"secondary_wall"},{"op":"fill_box","min":[17,2,12],"max":[18,2,12],"role":"accent_secondary"},{"op":"fill_box","min":[22,1,12],"max":[23,2,15],"role":"secondary_wall"},{"op":"fill_box","min":[22,2,12],"max":[23,2,12],"role":"accent_secondary"},{"op":"line","start":[3,1,20],"end":[3,6,20],"role":"wood"},{"op":"fill_box","min":[2,4,19],"max":[4,6,21],"role":"sign"},{"op":"fill_box","min":[2,5,19],"max":[4,5,21],"role":"accent_primary"}],"materialization":{"format":"vanilla_blueprint_primitives/v1","block_policy":"minecraft_namespace_only","purpose":"architectural_reference_not_engineering_specification"}}
