{"reference_id":"continuityworks:reference/northstar_rural_gas_station","version":1,"archetype_id":"continuityworks:archetype/rural_gas_station","corporate_language_id":"continuityworks:corporate/northstar_fuel","description":"Clean modern rural gas station reference: glazed store, thin branded canopy, two pump islands, and tall roadside pylon.","size":[31,9,25],"module_composition":[{"module_id":"continuityworks:module/standard_room_9x5x9","origin":[3,1,2]},{"module_id":"continuityworks:module/fuel_canopy_13x5x9","origin":[17,1,10]},{"module_id":"continuityworks:module/pump_island_3x3x5","origin":[20,1,13]},{"module_id":"continuityworks:module/pump_island_3x3x5","origin":[25,1,13]},{"module_id":"continuityworks:module/roadside_pylon_3x9x3","origin":[1,0,20]}],"present_signatures":["fuel_canopy","pump_islands","storefront","roadside_pylon","brand_band","parking","rear_service"],"blueprint":[{"op":"fill_box","min":[0,0,0],"max":[30,0,24],"role":"ground"},{"op":"hollow_box","min":[3,1,2],"max":[15,5,8],"role":"primary_wall"},{"op":"fill_box","min":[4,1,8],"max":[14,4,8],"role":"glass"},{"op":"fill_box","min":[2,6,1],"max":[16,6,9],"role":"roof"},{"op":"fill_box","min":[3,5,8],"max":[15,5,8],"role":"accent_primary"},{"op":"fill_box","min":[17,5,10],"max":[29,5,20],"role":"roof"},{"op":"fill_box","min":[17,5,10],"max":[29,5,10],"role":"accent_primary"},{"op":"fill_box","min":[17,5,20],"max":[29,5,20],"role":"accent_secondary"},{"op":"line","start":[18,1,11],"end":[18,4,11],"role":"metal"},{"op":"line","start":[28,1,11],"end":[28,4,11],"role":"metal"},{"op":"line","start":[18,1,19],"end":[18,4,19],"role":"metal"},{"op":"line","start":[28,1,19],"end":[28,4,19],"role":"metal"},{"op":"fill_box","min":[20,1,13],"max":[21,2,16],"role":"secondary_wall"},{"op":"fill_box","min":[20,2,13],"max":[21,2,13],"role":"accent_primary"},{"op":"fill_box","min":[25,1,13],"max":[26,2,16],"role":"secondary_wall"},{"op":"fill_box","min":[25,2,13],"max":[26,2,13],"role":"accent_primary"},{"op":"line","start":[2,1,21],"end":[2,8,21],"role":"metal"},{"op":"fill_box","min":[1,5,20],"max":[3,8,22],"role":"sign"},{"op":"fill_box","min":[1,7,20],"max":[3,7,22],"role":"accent_primary"},{"op":"fill_box","min":[1,6,20],"max":[3,6,22],"role":"accent_secondary"},{"op":"block","pos":[19,4,15],"role":"lighting"},{"op":"block","pos":[24,4,15],"role":"lighting"},{"op":"block","pos":[28,4,15],"role":"lighting"}],"materialization":{"format":"vanilla_blueprint_primitives/v1","block_policy":"minecraft_namespace_only","purpose":"architectural_reference_not_engineering_specification"}}
