{"reference_id":"continuityworks:reference/iron_mesa_crude_oil_well_pad","version":1,"archetype_id":"continuityworks:archetype/crude_oil_well_pad","corporate_language_id":"continuityworks:corporate/iron_mesa_energy","description":"Rugged crude-oil extraction pad reference with a dominant walking-beam pumpjack, collection piping, one storage tank, service shed, fence, and gravel access.","size":[29,10,25],"module_composition":[{"module_id":"continuityworks:module/pumpjack_9x8x9","origin":[10,1,9]},{"module_id":"continuityworks:module/storage_tank_9x7x9","origin":[19,1,3]},{"module_id":"continuityworks:module/pipe_rack_5x5x13","origin":[18,1,9]},{"module_id":"continuityworks:module/utility_service_9x5x9","origin":[2,1,3]}],"present_signatures":["pumpjack","open_equipment_pad","crude_storage","visible_product_piping","control_shed","perimeter_fence","service_road"],"blueprint":[{"op":"fill_box","min":[0,0,0],"max":[28,0,24],"role":"gravel"},{"op":"hollow_box","min":[1,1,1],"max":[27,3,23],"role":"fence"},{"op":"hollow_box","min":[2,1,3],"max":[8,4,8],"role":"primary_wall"},{"op":"fill_box","min":[2,5,3],"max":[8,5,8],"role":"roof"},{"op":"fill_box","min":[10,1,9],"max":[18,1,17],"role":"foundation"},{"op":"line","start":[12,2,13],"end":[14,6,13],"role":"metal"},{"op":"line","start":[16,2,13],"end":[14,6,13],"role":"metal"},{"op":"line","start":[11,6,13],"end":[18,6,13],"role":"dark_metal"},{"op":"line","start":[18,6,13],"end":[18,4,13],"role":"dark_metal"},{"op":"fill_box","min":[17,3,12],"max":[19,4,14],"role":"dark_metal"},{"op":"fill_box","min":[13,1,12],"max":[15,2,14],"role":"hazard"},{"op":"cylinder","center":[23,7],"radius":3,"y_min":1,"y_max":6,"mode":"shell","caps":true,"role":"tank"},{"op":"line","start":[18,2,13],"end":[23,2,13],"role":"pipe"},{"op":"line","start":[23,2,13],"end":[23,2,10],"role":"pipe"},{"op":"line","start":[23,2,10],"end":[23,2,9],"role":"pipe"},{"op":"fill_box","min":[0,0,18],"max":[6,0,24],"role":"ground"}],"materialization":{"format":"vanilla_blueprint_primitives/v1","block_policy":"minecraft_namespace_only","purpose":"architectural_reference_not_engineering_specification"}}
